agent_id,client_id,relationship_started,notes,status
34,3,1/05/2025 0:00,Interested in 3-bedroom apartments in Lagos.,vip
34,9,1/05/2025 0:00,Requested callback next Monday for follow-up.,vip
34,11,1/05/2025 0:00,Prefers properties with waterfront views.,vip
34,17,1/05/2025 0:00,"Sent documents, waiting on legal review.",regular
34,26,1/05/2025 0:00,Looking for investment opportunities in Abuja.,regular
34,27,1/05/2025 0:00,Needs relocation within 60 days.,regular
34,29,1/05/2025 0:00,Inquired about flexible payment options.,regular
34,36,1/05/2025 0:00,"First-time buyer, needs mortgage guidance.",regular
